{
  "person": {
    "birth_date": "1990-06-15",
    "citizenship": ["CN"],
    "marital_status": "married",
    "children": 0,
    "spouse_profile": {
      "birth_date": "1992-08-20",
      "highest_degree": "bachelor",
      "language": {"test": "ielts", "overall": 6.0, "speaking": 6.0, "listening": 6.0, "reading": 6.0, "writing": 5.5},
      "years_related": 4
    }
  },
  "education": {
    "highest_degree": "master",
    "field": "computer_science",
    "country": "CN",
    "completed_date": "2015-06-30",
    "eca_done": true
  },
  "language": {
    "english": {"test": "ielts", "overall": 7.5, "speaking": 7.0, "listening": 8.0, "reading": 7.5, "writing": 7.0},
    "other": {"jlpt": "N1"}
  },
  "work": {
    "occupation_title": "software engineer",
    "years_total": 8,
    "years_related": 7,
    "years_in": {"CA": 0},
    "income_annual": {"amount": 8000000, "currency": "JPY"}
  },
  "credentials": {
    "skills_assessment": {"authority": "", "occupation_code": "", "status": "not_started", "completed_date": null}
  },
  "intent": {"target_countries": ["CA", "JP"], "timeline": "2y"}
}
