{
  "person": {"birth_date": "1999-03-14", "citizenship": ["CN"], "marital_status": "married", "children": 0,
    "spouse_profile": {"birth_date": "1991-08-08", "highest_degree": "bachelor",
      "language": {"test": "ielts", "overall": 6.0, "speaking": 6.0, "listening": 6.0, "reading": 6.0, "writing": 5.5}, "years_related": 4}},
  "education": {"highest_degree": "master", "country": "CN", "completed_date": "2015-06-30", "eca_done": true},
  "language": {"english": {"test": "ielts", "overall": 7.5, "speaking": 7.0, "listening": 8.0, "reading": 7.0, "writing": 7.0}},
  "work": {"occupation_title": "software engineer", "years_total": 5, "years_related": 5, "income_annual": {"amount": 600000, "currency": "CNY"}},
  "intent": {"target_countries": ["CA"]}
}
