{
  "person": {"birth_date": "1994-05-20", "citizenship": ["CN"], "marital_status": "single", "children": 0},
  "education": {"highest_degree": "bachelor", "country": "CN", "completed_date": "2015-06-30", "eca_done": true},
  "language": {"english": {"test": "none"}, "other": {"jlpt": "N2"}},
  "work": {"occupation_title": "engineer", "years_total": 4, "years_related": 4, "income_annual": {"amount": 8000000, "currency": "JPY"}},
  "intent": {"target_countries": ["JP"]}
}
