{
  "person": {"birth_date": "1998-11-11", "citizenship": ["CN"], "marital_status": "single", "children": 0},
  "education": {"highest_degree": "master", "country": "CN", "completed_date": "2016-06-30", "eca_done": true},
  "language": {"english": {"test": "ielts", "overall": 7.5, "speaking": 7.0, "listening": 8.0, "reading": 7.0, "writing": 7.0}},
  "work": {"occupation_title": "software engineer", "years_total": 5, "years_related": 5, "years_in": {"CA": 2}, "income_annual": {"amount": 600000, "currency": "CNY"}},
  "intent": {"target_countries": ["CA"], "job_offer_wage_tier": "2x"}
}
